{
  "schema_version": 1,
  "handoff_id": "h_BE_014",
  "project_id": "p_demo",
  "run_id": "r_demo",
  "task_id": "BE-014",
  "from_session": "s_backend_1",
  "to_role": "reviewer",
  "summary": "Backend auth route ready for independent review; check diff and negative tests",
  "artifacts": [
    {
      "path": ".weave/evidence/BE-014-test.log",
      "sha256": "bbbbbbbbbbbbbbbbbbbbbbbbbbbbbbbbbbbbbbbbbbbbbbbbbbbbbbbbbbbbbbbb"
    }
  ],
  "blockers": [],
  "contract_pins": [
    {
      "contract_id": "AUTH",
      "version": "1.0.0",
      "sha256": "aaaaaaaaaaaaaaaaaaaaaaaaaaaaaaaaaaaaaaaaaaaaaaaaaaaaaaaaaaaaaaaa"
    }
  ],
  "created_at": "2026-10-13T14:32:00Z"
}
